<?xml version="1.0" encoding="UTF-8"?>
<xs:schema xmlns:xs="http://www.w3.org/2001/XMLSchema"
	targetNamespace="http://www.uniovi.es"
	xmlns="http://www.uniovi.es"
	elementFormDefault="qualified">
	<xs:element name="circuito">
		<xs:complexType>
			<xs:sequence>
				<xs:element ref="nombre" />
				<xs:element ref="longitud" />
				<xs:element ref="anchura" />
				<xs:element ref="fecha" />
				<xs:element ref="vueltas" />
				<xs:element ref="localidad" />
				<xs:element ref="pais" />
				<xs:element ref="referencias" />
				<xs:element ref="fotos" />
				<xs:element ref="videos" />
				<xs:element ref="coord" />
				<xs:element ref="tramos" />
			</xs:sequence>
		</xs:complexType>
	</xs:element>
	<xs:element name="nombre" type="xs:string" />
	<xs:element name="longitud">
		<xs:complexType>
			<xs:simpleContent>
				<xs:extension base="xs:string">
					<xs:attribute name="unidad" type="xs:string" use="required" />
					<xs:attribute name="valor" use="required" >
						<xs:simpleType>
							<xs:restriction base="xs:integer">
								<xs:minInclusive value="0"/>
								<xs:maxInclusive value="8000"/>
							</xs:restriction>
						</xs:simpleType>	
					</xs:attribute>
				</xs:extension>
			</xs:simpleContent>
		</xs:complexType>
	</xs:element>
	<xs:element name="anchura">
		<xs:complexType>
			<xs:simpleContent>
				<xs:extension base="xs:string">
					<xs:attribute name="unidad" type="xs:string" use="required" />
					<xs:attribute name="valor" use="required" >
						<xs:simpleType>
							<xs:restriction base="xs:integer">
								<xs:minInclusive value="0"/>
								<xs:maxInclusive value="30"/>
							</xs:restriction>
						</xs:simpleType>	
					</xs:attribute>
				</xs:extension>
			</xs:simpleContent>
		</xs:complexType>
	</xs:element>
	<xs:element name="fecha" type="xs:dateTime" />
	<xs:element name="vueltas" >
		<xs:simpleType>
			<xs:restriction base="xs:integer">
				<xs:minInclusive value="0"/>
				<xs:maxInclusive value="150"/>
			</xs:restriction>
		</xs:simpleType>	
	</xs:element>
	<xs:element name="localidad" type="xs:string" />
	<xs:element name="pais" type="xs:string" />
	<xs:element name="referencias">
		<xs:complexType>
			<xs:sequence>
				<xs:element minOccurs="1" maxOccurs="5" ref="referencia" />
			</xs:sequence>
		</xs:complexType>
	</xs:element>
	<xs:element name="referencia" type="xs:string" />
	<xs:element name="fotos">
		<xs:complexType>
			<xs:sequence>
				<xs:element minOccurs="1" maxOccurs="5" ref="foto" />
			</xs:sequence>
		</xs:complexType>
	</xs:element>
	<xs:element name="foto" type="xs:string" />
	<xs:element name="videos">
		<xs:complexType>
			<xs:sequence>
				<xs:element minOccurs="0" maxOccurs="5" ref="video" />
			</xs:sequence>
		</xs:complexType>
	</xs:element>
	<xs:element name="video" type="xs:string" />
	<xs:element name="coord">
		<xs:complexType>
			<xs:simpleContent>
				<xs:extension base="xs:string">
					<xs:attribute name="latitud" type="xs:decimal" use="required" />
					<xs:attribute name="longitud" type="xs:decimal" use="required" />
					<xs:attribute name="altitud" use="required">
						<xs:simpleType>
							<xs:restriction base="xs:decimal">
								<xs:minInclusive value="0"/>
								<xs:maxInclusive value="2000"/>
							</xs:restriction>
						</xs:simpleType>	
					</xs:attribute>
				</xs:extension>
			</xs:simpleContent>
		</xs:complexType>
	</xs:element>
	<xs:element name="tramos">
		<xs:complexType>
			<xs:sequence>
				<xs:element minOccurs="1" maxOccurs="50" ref="tramo" />
			</xs:sequence>
		</xs:complexType>
	</xs:element>
	<xs:element name="tramo">
		<xs:complexType>
			<xs:simpleContent>
				<xs:extension base="xs:string">
					<xs:attribute name="distancia" type="xs:integer" use="required" />
					<xs:attribute name="latitud" type="xs:decimal" use="required" />
					<xs:attribute name="longitud" type="xs:decimal" use="required" />
					<xs:attribute name="altitud" use="required" >
						<xs:simpleType>
							<xs:restriction base="xs:integer">
								<xs:minInclusive value="0"/>
								<xs:maxInclusive value="2000"/>
							</xs:restriction>
						</xs:simpleType>	
					</xs:attribute>
					<xs:attribute name="nsector" use="required">
						<xs:simpleType>
							<xs:restriction base="xs:integer">
								<xs:minInclusive value="0"/>
								<xs:maxInclusive value="30"/>
							</xs:restriction>
						</xs:simpleType>	
					</xs:attribute>
				</xs:extension>
			</xs:simpleContent>
		</xs:complexType>
	</xs:element>
	<xs:element name="distancia">
		<xs:complexType>
			<xs:simpleContent>
				<xs:extension base="xs:string">
					<xs:attribute name="unidad" type="xs:string" use="required" />
					<xs:attribute name="valor" type="xs:integer" use="required" />
				</xs:extension>
			</xs:simpleContent>
		</xs:complexType>
	</xs:element>
	<xs:element name="sector" type="xs:string" />
</xs:schema>